{
  "schema_version": "1.0.0",
  "session_id": "sess_l5_0001",
  "objective_id": "obj_l5_script",
  "created_at": "2026-02-06T13:30:00Z",
  "input_artifact_refs": [
    {
      "name": "script_seed_pack",
      "path": "examples/artifacts/sample_script_seed_pack.json"
    },
    {
      "name": "topic_research_bundle",
      "path": "examples/artifacts/sample_topic_research_bundle.json"
    },
    {
      "name": "entity_profile_pack",
      "path": "examples/artifacts/sample_entity_profile_pack.json"
    }
  ]
}
