{
  "schema_version": "1.0.0",
  "session_id": "sess_l4_0001",
  "objective_id": "obj_l4_hook",
  "created_at": "2026-02-06T12:30:00Z",
  "input_artifact_refs": [
    {
      "name": "topic_research_bundle",
      "path": "examples/artifacts/sample_topic_research_bundle.json"
    },
    {
      "name": "entity_profile_pack",
      "path": "examples/artifacts/sample_entity_profile_pack.json"
    }
  ]
}
